{
  "$schema": "./hancom-operation-catalog.schema.json",
  "schema_version": "rigorloom/hancom-operation-catalog-v1",
  "product_candidate_commit": "e53e99abc994cd5aa2780e5d184220dea8c03708",
  "planning_contract_commit": "609f834ce21e55f481604559f26a8d52aeeaf15f",
  "operations": [
    {
      "id": "preedit:fill_cell",
      "operation_key": "fill_cell",
      "surface": "cli.py plan/apply",
      "backend": "preedit",
      "target_kinds": [
        "cell_address"
      ],
      "implementation_reference": {
        "path": "engine/scripts/preedit.py",
        "line": 1291,
        "symbol": "fill_cells"
      },
      "test_references": [
        {
          "path": "engine/tests/test_preedit.py",
          "node": "test_truly_empty_cell_is_routed_to_fill_cells"
        }
      ],
      "documentation_claim": {
        "path": "docs/plans/rigorloom-master-execution-plan.md",
        "line": 167,
        "topic": "templates/forms"
      },
      "strongest_evidence_category": "focused",
      "refusals": [
        "non_empty_cell_without_overwrite",
        "missing_table_index",
        "duplicate_address",
        "out_of_range_row_col"
      ],
      "missing_evidence": [
        "native_parity_proof",
        "visual_render_evidence"
      ]
    },
    {
      "id": "preedit:replace_at_cell",
      "operation_key": "replace_at_cell",
      "surface": "cli.py plan/apply",
      "backend": "preedit",
      "target_kinds": [
        "cell_address"
      ],
      "implementation_reference": {
        "path": "engine/scripts/preedit.py",
        "line": 1681,
        "symbol": "replace_at_cells"
      },
      "test_references": [
        {
          "path": "engine/tests/test_preedit.py",
          "node": "test_replace_nested_cell_precision"
        }
      ],
      "documentation_claim": {
        "path": "docs/plans/rigorloom-master-execution-plan.md",
        "line": 167,
        "topic": "templates/forms"
      },
      "strongest_evidence_category": "focused",
      "refusals": [
        "at_cell_expect_mismatch",
        "multi_run_cell_without_run_index",
        "missing_cell"
      ],
      "missing_evidence": [
        "native_parity_proof",
        "visual_render_evidence"
      ]
    },
    {
      "id": "preedit:set_run",
      "operation_key": "set_run",
      "surface": "cli.py plan/apply",
      "backend": "preedit",
      "target_kinds": [
        "paragraph_run_index"
      ],
      "implementation_reference": {
        "path": "engine/scripts/preedit.py",
        "line": 848,
        "symbol": "set_runs"
      },
      "test_references": [
        {
          "path": "engine/tests/test_preedit.py",
          "node": "test_named_run_edits_only_that_run"
        }
      ],
      "documentation_claim": {
        "path": "docs/plans/rigorloom-master-execution-plan.md",
        "line": 165,
        "topic": "Unicode text/ranges"
      },
      "strongest_evidence_category": "focused",
      "refusals": [
        "out_of_range_run_index",
        "out_of_range_paragraph_index",
        "duplicate_address"
      ],
      "missing_evidence": [
        "native_parity_proof",
        "visual_render_evidence"
      ]
    },
    {
      "id": "preedit:delete_guides",
      "operation_key": "delete_guides",
      "surface": "cli.py plan/apply",
      "backend": "preedit",
      "target_kinds": [
        "document"
      ],
      "implementation_reference": {
        "path": "engine/scripts/preedit.py",
        "line": 1928,
        "symbol": "delete_guide_paragraphs"
      },
      "test_references": [
        {
          "path": "engine/tests/test_preedit.py",
          "node": "test_plain_guide_para_deleted_black_stays"
        }
      ],
      "documentation_claim": {
        "path": "docs/plans/rigorloom-master-execution-plan.md",
        "line": 167,
        "topic": "templates/forms"
      },
      "strongest_evidence_category": "focused",
      "refusals": [
        "missing_guide_selector"
      ],
      "missing_evidence": [
        "native_parity_proof",
        "visual_render_evidence"
      ]
    },
    {
      "id": "native:replace_all",
      "operation_key": "replace_all",
      "surface": "com_backend.py edit",
      "backend": "com",
      "target_kinds": [
        "document"
      ],
      "implementation_reference": {
        "path": "engine/scripts/com_backend.py",
        "line": 418,
        "symbol": "op_replace_all"
      },
      "test_references": [],
      "documentation_claim": {
        "path": "docs/plans/rigorloom-master-execution-plan.md",
        "line": 165,
        "topic": "Unicode text/ranges"
      },
      "strongest_evidence_category": "source",
      "refusals": [
        "missing_find_param",
        "missing_replace_param"
      ],
      "missing_evidence": [
        "focused_unit_test",
        "native_com_automated_test"
      ]
    },
    {
      "id": "native:put_field",
      "operation_key": "put_field",
      "surface": "com_backend.py edit",
      "backend": "com",
      "target_kinds": [
        "field"
      ],
      "implementation_reference": {
        "path": "engine/scripts/com_backend.py",
        "line": 424,
        "symbol": "op_put_field"
      },
      "test_references": [],
      "documentation_claim": {
        "path": "docs/plans/rigorloom-master-execution-plan.md",
        "line": 167,
        "topic": "fields/references"
      },
      "strongest_evidence_category": "source",
      "refusals": [
        "missing_field_name"
      ],
      "missing_evidence": [
        "focused_unit_test",
        "native_com_automated_test"
      ]
    },
    {
      "id": "native:goto_text",
      "operation_key": "goto_text",
      "surface": "com_backend.py edit",
      "backend": "com",
      "target_kinds": [
        "text_anchor"
      ],
      "implementation_reference": {
        "path": "engine/scripts/com_backend.py",
        "line": 451,
        "symbol": "op_goto_text"
      },
      "test_references": [],
      "documentation_claim": {
        "path": "docs/plans/rigorloom-master-execution-plan.md",
        "line": 165,
        "topic": "Unicode text/ranges"
      },
      "strongest_evidence_category": "source",
      "refusals": [
        "text_not_found"
      ],
      "missing_evidence": [
        "focused_unit_test",
        "native_com_automated_test"
      ]
    },
    {
      "id": "native:find_delete",
      "operation_key": "find_delete",
      "surface": "com_backend.py edit",
      "backend": "com",
      "target_kinds": [
        "text_anchor"
      ],
      "implementation_reference": {
        "path": "engine/scripts/com_backend.py",
        "line": 513,
        "symbol": "op_find_delete"
      },
      "test_references": [],
      "documentation_claim": {
        "path": "docs/plans/rigorloom-master-execution-plan.md",
        "line": 165,
        "topic": "Unicode text/ranges"
      },
      "strongest_evidence_category": "source",
      "refusals": [
        "text_not_found"
      ],
      "missing_evidence": [
        "focused_unit_test",
        "native_com_automated_test"
      ]
    },
    {
      "id": "native:collapse_empty_paragraphs",
      "operation_key": "collapse_empty_paragraphs",
      "surface": "com_backend.py edit",
      "backend": "com",
      "target_kinds": [
        "document"
      ],
      "implementation_reference": {
        "path": "engine/scripts/com_backend.py",
        "line": 597,
        "symbol": "op_collapse_empty_paragraphs"
      },
      "test_references": [],
      "documentation_claim": {
        "path": "docs/plans/rigorloom-master-execution-plan.md",
        "line": 165,
        "topic": "character and paragraph formatting"
      },
      "strongest_evidence_category": "source",
      "refusals": [],
      "missing_evidence": [
        "focused_unit_test",
        "native_com_automated_test"
      ]
    },
    {
      "id": "native:delete_blank_after",
      "operation_key": "delete_blank_after",
      "surface": "com_backend.py edit",
      "backend": "com",
      "target_kinds": [
        "cursor"
      ],
      "implementation_reference": {
        "path": "engine/scripts/com_backend.py",
        "line": 623,
        "symbol": "op_delete_blank_after"
      },
      "test_references": [],
      "documentation_claim": {
        "path": "docs/plans/rigorloom-master-execution-plan.md",
        "line": 165,
        "topic": "character and paragraph formatting"
      },
      "strongest_evidence_category": "source",
      "refusals": [],
      "missing_evidence": [
        "focused_unit_test",
        "native_com_automated_test"
      ]
    },
    {
      "id": "native:delete_blank_before",
      "operation_key": "delete_blank_before",
      "surface": "com_backend.py edit",
      "backend": "com",
      "target_kinds": [
        "cursor"
      ],
      "implementation_reference": {
        "path": "engine/scripts/com_backend.py",
        "line": 654,
        "symbol": "op_delete_blank_before"
      },
      "test_references": [],
      "documentation_claim": {
        "path": "docs/plans/rigorloom-master-execution-plan.md",
        "line": 165,
        "topic": "character and paragraph formatting"
      },
      "strongest_evidence_category": "source",
      "refusals": [],
      "missing_evidence": [
        "focused_unit_test",
        "native_com_automated_test"
      ]
    },
    {
      "id": "native:move",
      "operation_key": "move",
      "surface": "com_backend.py edit",
      "backend": "com",
      "target_kinds": [
        "cursor"
      ],
      "implementation_reference": {
        "path": "engine/scripts/com_backend.py",
        "line": 683,
        "symbol": "op_move"
      },
      "test_references": [
        {
          "path": "engine/tests/test_com_backend_offline.py",
          "node": "test_walk_aborts_when_the_cursor_does_not_move"
        }
      ],
      "documentation_claim": {
        "path": "docs/plans/rigorloom-master-execution-plan.md",